{
  "$schema": "./component.schema.json",
  "id": "divider",
  "name": "Divider",
  "version": "0.1.0",
  "status": "draft",
  "category": "container",
  "description": "Línea fina que separa dos grupos de contenido. Es el contrato más corto del sistema: sirve de ejemplo para empezar.",
  "guidance": {
    "dos": [
      "Úsalo para separar grupos de contenido distintos, no cada elemento de una lista.",
      "Si solo es decorativo, pon `decorative` para que los lectores de pantalla lo ignoren."
    ],
    "donts": [
      {
        "case": "Separar dos elementos pequeños y cercanos",
        "useInstead": "El espaciado (gap) del contenedor",
        "why": "Una línea entre cada par de elementos ensucia la pantalla; el espacio ya los separa."
      },
      {
        "case": "Dibujar un borde alrededor de un bloque",
        "useInstead": "El borde del propio bloque",
        "why": "Un Divider es una línea suelta, no un marco."
      }
    ],
    "related": []
  },
  "semantics": {
    "element": "div",
    "role": "separator",
    "refTarget": "root",
    "elementByProp": null
  },
  "props": [
    {
      "name": "orientation",
      "type": "'horizontal' | 'vertical'",
      "default": "horizontal",
      "required": false,
      "description": "horizontal: línea a todo lo ancho. vertical: línea a todo lo alto.",
      "bindings": { "figma": { "property": "orientation", "type": "VARIANT" } }
    },
    {
      "name": "decorative",
      "type": "boolean",
      "default": false,
      "required": false,
      "description": "true: es solo decoración y se oculta a los lectores de pantalla. false: se anuncia como separador.",
      "bindings": { "figma": null }
    }
  ],
  "states": {
    "native": [],
    "controlled": []
  },
  "anatomy": {
    "root": {
      "element": "div",
      "description": "Única parte: la línea.",
      "figmaLayer": "Divider"
    }
  },
  "tokens": {
    "policy": { "allowed": ["colors"], "forbidden": [] },
    "bindings": {
      "base": { "background": "colors.neutral.neutral-alpha.6", "thickness": 1 }
    }
  },
  "a11y": {
    "role": "separator, o ninguno si decorative=true",
    "name": "No necesita nombre accesible.",
    "keyboard": [],
    "focusIndicator": "No recibe foco.",
    "minTarget": "No es interactivo: no aplica.",
    "contrastNote": "Es decorativo o estructural: no se exige contraste de texto. Si separa zonas importantes, comprobar que se ve sobre el fondo.",
    "wcag": ["1.3.1 Información y relaciones"]
  },
  "anchors": {
    "code": { "importPath": "@/components/divider/divider", "export": "Divider" }
  },
  "meta": {
    "source": "ejemplo didáctico",
    "derivableFromSource": ["props.type"],
    "needsReview": [
      "Ejemplo pensado para aprender el formato: no está leído de ningún archivo de Figma. Antes de usarlo en producción, dibujar el componente y enlazar `anchors.figma`."
    ]
  }
}
